condition,food,warning,explanation
cardiovascular disease,milk,dangerous,"Milk and dairy products containing milk fat are major food sources of saturated fatty acids, which have been linked to increased risk of cardiovascular-related clinical outcomes such as cardiovascular disease (CVD), coronary heart disease (CHD), and stroke."
Prediabetes,Stew (meat/rice/vegetable),can worsen,Stew (meat/rice/vegetable) with serving size 140.0g recorded in NHANES dietary data for Hypertension and Prediabetes patients.
colorectal cancer,garlic,safe,Garlic and its constituents are reported to have a preventive effect against colorectal cancer in animal models.
Prediabetes,raw apple/apricot/avocado/banana/cantaloupe/cherries/fig/grapes/mango/pear/pineapple/,safe,raw apple/apricot/avocado/banana/cantaloupe/cherries/fig/grapes/mango/pear/pineapple/ may support balanced diet for prediabetes.
musculoskeletal diseases,fruit of lycium chinense (lc),safe,"The fruit of Lycium chinense (LC), one of the most popular natural materials, has been used to counter the effects of musculoskeletal diseases in oriental medicine."
Hypertension,Sussages,can worsen,Sussages with serving size 100.0g recorded in NHANES dietary data for Hypertension and Prediabetes patients.
baker's asthma,wheat flour,dangerous,Sensitization to wheat flour plays an important role in the development and diagnosis of baker's asthma.
cardiovascular diseases,labiatae,safe,"Use of Labiatae as food or food additives (such as spices) may prevent risk of cardiovascular diseases, diabetes and cancer."
Prediabetes,Cakes/cookies/pies,safe,Cakes/cookies/pies may support balanced diet for prediabetes.
inflammation,mediet,safe,"Several clinical, epidemiological and experimental evidences suggest that consumption of the MeDiet reduces the incidence of certain pathologies related to oxidative stress, chronic inflammation and immune system diseases such as cancer, atherosclerosis and cardiovascular disease (CVD)."
Hypertension,Lamb/Goat/Veal/Venison,safe,Lamb/Goat/Veal/Venison may support balanced diet for hypertension.
Hypertension,Cakes/cookies/pies,safe,Cakes/cookies/pies may support balanced diet for hypertension.
stone recurrence in hypercalciuric renal stone formers,salt,safe,A diet based on a adequate intake of calcium (1000-1200 mg per day) and containment of animal protein and salt can decrease significantly urinary supersaturation for calcium oxalate and reduce the relative risk of stone recurrence in hypercalciuric renal stone formers.
anemia deficiency,glycine max,safe,"Glycine max is commonly used in Algeria for treatment of anemia deficiency and osteoporosis, it ranks first in terms of vegetal proteins."
anemia,poor quality of the diets,dangerous,"These findings suggest that in rural China, anemia stems from the poor quality of the diets of infants/toddlers, rather than insufficient quantities of food being consumed."
Hypertension,salad dressing,can worsen,salad dressing with serving size 14.0g recorded in NHANES dietary data for Hypertension and Prediabetes patients.
"cardiovascular, neurodegenerative",docosahexaenoic acid,safe,"Omega-3 fatty acids (ÃÂÃÂ-3FAs) such as Docosahexaenoic acid (DHA) and Eicosapentanoic acid (EPA), are active ingredient of fish oil, which have larger health benefits against various diseases including cardiovascular, neurodegenerative, cancers and bone diseases."
joint inflammatory diseases,extra virgin olive oil,safe,"Recently, oleocanthal isolated from extra virgin olive oil was found to display nonsteroidal antiinflammatory drug activity similar to that of ibuprofen, a drug widely used in the therapeutic management of joint inflammatory diseases."
neural tube defects,wheat flour,safe,"The mandatory fortification of enriched cereal grains (e.g., wheat flour) with folic acid, which began in the United States in 1998, is an example of a successful intervention that significantly reduced the rate of neural tube defects (NTDs)."
cardiometabolic diseases,dairy products,dangerous,Dairy products contain both beneficial and harmful nutrients in relation to cardiometabolic diseases.
allergic reactions,rice,dangerous,Allergen Glb33 is an important allergen in rice that can cause allergic reactions such as asthma and atopic dermatitis.
chills,capsinoids from nonpungent chili pepper,safe,"Capsinoids from nonpungent chili pepper cultivar have been reported to reduce body fat mass, promote metabolism, and improve unidentified complaints of chills."
behavioral dysfunction,ginger,safe,Our previous study suggests that ginger root extract can reverse behavioral dysfunction and prevent Alzheimer's disease (AD)-like symptoms induced by the amyloid-ÃÂÃÂ² protein (AÃÂÃÂ²) in a rat model.
inflammation,olea europaea,safe,Bioactive extracts from Olea europaea have anti-inflammatory activity and have been shown to reduce systemic inflammation in other animal models.
diarrhea,quercus liaotungensis koidz,safe,"Acorn obtained from the Quercus liaotungensis Koidz tree is consumed as a Chinese folk medicine for the treatment of diarrhea, abdominal pain, and inflammation, also having strong antioxidant activity and have been utilized for the treatment of diabetes in China."
respiratory diseases,flour dust,dangerous,"For decades, occupational exposure to flour dust has been linked to a range of respiratory diseases, including occupational asthma, thought to result from exposure to fungi present in the flour."
calcium oxalate urolithiasis,salt,dangerous,Dietary excesses in animal protein and/or salt have been implicated as risk factors in calcium oxalate urolithiasis.
Prediabetes,Cakes/cookies/pies,safe,Cakes/cookies/pies may support balanced diet for prediabetes.
Hypertension,carrots/pumpkin/squash/sweet potato/,can worsen,carrots/pumpkin/squash/sweet potato/ with serving size 72.0g recorded in NHANES dietary data for Hypertension and Prediabetes patients.
neurodegenerative diseases,unbalanced diet,dangerous,"In the last decade, several theories investigating the causes of neurodegenerative diseases have been formulated and a condition or risk factor that can contribute is described by the gut-brain axis hypothesis: stress, unbalanced diet, and drugs impact altering microbiota composition which contributes to dysbiosis."
Prediabetes,Pork,dangerous,Pork is high in fat/sugar and may worsen prediabetes.
stroke,native olive oil,safe,"The only evidence from randomised controlled trials is, that a mediterranean diet with nuts and/or native olive oil considerably reduces stroke risk by 47% respectively 31%, however not the risk of myocardial infarction and death."
diabetic,beans,safe,"Common beans have been associated with anti-diabetic effects, due to its high content of bioactive compounds."
Prediabetes,coffee/soda drink/iced tea,dangerous,coffee/soda drink/iced tea is high in fat/sugar and may worsen prediabetes.
human diseases,extra-virgin olive oil,safe,"Oleocanthal (OLC) is a phenolic component of extra-virgin olive oil, recently supposed to be involved in the modulation of some human diseases, such as inflammation and Alzheimer."
asthma,certain foods,safe,Consumption of certain foods during pregnancy has been shown to have beneficial effects on childhood asthma and allergic disease development and aggravation.
allergic reactions,wheat,dangerous,Wheat is one of the five most common foods that trigger allergic reactions in children.
stone recurrence in hypercalciuric renal stone formers,salt,safe,A diet based on a adequate intake of calcium (1000-1200 mg per day) and containment of animal protein and salt can decrease significantly urinary supersaturation for calcium oxalate and reduce the relative risk of stone recurrence in hypercalciuric renal stone formers.
Prediabetes,Beef,can worsen,Beef with serving size 65.0g recorded in NHANES dietary data for Hypertension and Prediabetes patients.
autoimmune diseases,processed foods,dangerous,"Among these, dietary habits, and especially an excessive salt, typical of processed foods, has been implicated in the development of autoimmune diseases."
ad,rice,safe,Components of the germ layer and bran of Brown rice (BR) help maintain good health and prevent AD.
allergy,rice,dangerous,"In rice allergy, proteins with molecular masses of 14-16, 26, 33, and 56 kDa have been demonstrated to be potentially allergenic."
ra,experimental drug,safe,"As only 10% of experimental drug candidates for treatment of RA that enter phase I trials are eventually registered by the Food and Drug Administration, there is an immediate need for translational tools to facilitate early decision-making in drug development."
asthma,apple juice,dangerous,"Intake of beverages with excess free fructose (EFF), including apple juice, and HFCS sweetened fruit drinks and soft drinks, has been associated with asthma in children."
knee osteoarthritis,avocado soybean unsaponifiables (asu),safe,"Avocado soybean unsaponifiables (ASU) has proven its safety and effectiveness in clinical studies of knee osteoarthritis (OA); however, whether ASU exerts structure-modifying effects is still to be elucidated."
colorectal cancer,garlic,safe,Garlic and its constituents are reported to have a preventive effect against colorectal cancer in animal models.
Hypertension,grapefruit/lemon/orange,can worsen,grapefruit/lemon/orange with serving size 236.0g recorded in NHANES dietary data for Hypertension and Prediabetes patients.
alzheimer's disease,beer,safe,"We have previously demonstrated that the consumption of iso-ÃÂÃÂ±-acids (IAA), which are hop-derived bitter compounds in beer, prevents the formation of disease pathology in a transgenic mouse model of Alzheimer's disease (AD)."
bladder cancer,fruit,safe,"Fruit and vegetable consumption was inversely related with bladder cancer in many studies, but no consistent association has emerged between intake of related micronutrients and reduced risk of bladder cancer."
Hypertension,Bread,safe,Bread may support balanced diet for hypertension.
Prediabetes,egg omelet,can worsen,egg omelet with serving size 61.0g recorded in NHANES dietary data for Hypertension and Prediabetes patients.
Prediabetes,Sussages,safe,Sussages may support balanced diet for prediabetes.
cognitive decline,red wine,safe,These effects have been related to the protection against cognitive decline associated with aging and disease by a number of polyphenols found in red wine and extra virgin olive oil.
Hypertension,Stew (meat/rice/vegetable),can worsen,Stew (meat/rice/vegetable) with serving size 140.0g recorded in NHANES dietary data for Hypertension and Prediabetes patients.
carcinogenic,ginger root,safe,"Zingerone, a major component found in ginger root, has been known as anti-mutagenic and anti-carcinogenic activities that are often associated with its anti-oxidative and anti-inflammatory activities."
nephrolithiasis,high carbohydrate diets,dangerous,"Based on these observations, some investigators believe that long term intake of high carbohydrate diets may increase the risk of nephrolithiasis and possibly osteoporosis."
Prediabetes,Biscuits,safe,Biscuits may support balanced diet for prediabetes.
cancers,allium,safe,Many epidemiological studies support the protective role of garlic and related allium foods against the development of certain human cancers.
cognitive decline,fruit,safe,"Finally, the limited epidemiological evidence available on fruit and vegetable consumption and cognition generally supported a protective role of these macronutrients against cognitive decline, dementia, and AD."
occupational respiratory allergies,wheat flour,dangerous,Exposure to wheat flour and guar gum is a well-known cause of occupational respiratory allergies among workers in the food processing industry.
cognitive impairment,soybean curd,dangerous,"Paradoxically, the Honolulu Asia Aging Study reported an increased risk for cognitive impairment and other dementia markers with high tofu (soybean curd) intake."
stroke,mediterranean diet,safe,The Mediterranean diet (MD) has been shown to lower stroke risk.
neurodegenerative diseases,various foods,safe,"Many reports have indicated that luteolin, a flavone found in various foods, has preventive and therapeutic value for neurodegenerative diseases including AD."
Hypertension,potato,safe,potato may support balanced diet for hypertension.
Prediabetes,Biscuits,safe,Biscuits may support balanced diet for prediabetes.
type 2 diabetes,cocoa consumption,safe,"Regular cocoa consumption has been shown to improve blood pressure (BP), insulin sensitivity, and lipid levels in patients with type 2 diabetes (T2D), using up to 100 g of chocolate or 54 g of cocoa."
cardiovascular disease,olive oil),safe,Epidemiological studies suggest that a Mediterranean diet (which is rich in virgin olive oil) decreases the risk of cardiovascular disease.
diabetic,beans,safe,"Common beans have been associated with anti-diabetic effects, due to its high content of bioactive compounds."
migraine attacks,cabbage,dangerous,"Migraine attacks have been produced most frequently by cow milk (in 10 out of 17 patients), cabbage, flour and eggs in 5 patients, preservatives, cottage and Swiss cheese, porcine meat in 4 patients, colorants and chocolate in 3 patients, beef, strawberries, lemons and butter in 2 patients."
hypertension,coffee,safe,"Respondents with overweight (AOR 1.44, 95%CI: 1.02-2.02), khat chewing (AOR3.31, 95%CI: 1.94-5.64), low fruit and/or vegetable consumption (AOR 1.27, 95%CI: 1.05-1.53) and those who do not use coffee and tea (AOR 1.52, 95%CI: 1.03-2.24) had significantly higher likelihood of hypertension."
cancer,garlic intake,safe,Numerous animal and in vitro studies provided evidence for a relation between garlic intake and cancer risk reduction.
allergy,cow's milk protein,dangerous,"Cow's milk protein allergy, which occurs in approximately 5-10% of the population of infants and children, has become an important public food safety problem."
bone loss,regular-fish oil,safe,"The preventive effect of high-dose (9%) regular-fish oil (FO) against bone loss during aging has been demonstrated, but the effects of a low-dose (1%-4%) of a highly purified concentrated FO (CFO) has not been elucidated."
Hypertension,egg omelet,safe,egg omelet may support balanced diet for hypertension.
ad,anti-inflammatory drugs,safe,"Thus, anti-inflammatory drugs in this asymptomatic initial phase could slow down AD progression, provided they enter the brain."
osteoporosis,milk consumption,safe,Milk consumption is an accepted strategy in building peak bone mass and therefore may reduce the risk of osteoporosis.
insulin resistance,cocoa plant,safe,"Flavanoids in the cocoa plant may ameliorate insulin resistance by improving endothelial function, altering glucose metabolism, and reducing oxidative stress."
heinz body hemolytic anemia,garlic,dangerous,", including garlic (A. sativum) and onions (A. cepa), are known to be oxidatively toxic to canine erythrocytes resulting in Heinz body hemolytic anemia in dogs."
diabetes,flour,dangerous,"Alloxan (ALX), a food-additive, intaken daily through flour causes diabetes and genotoxicity by inducing chromosomal-aberration and DNA-damage."
ad,coffee beans,safe,"In addition, eicosanoyl-5-hydroxytryptamide (EHT), a naturally occurring component from coffee beans that modulates PP2A methylation, was shown to confer therapeutic benefits in rodent models of AD and Parkinson's disease."
Prediabetes,Sussages,safe,Sussages may support balanced diet for prediabetes.
arterial hypertension,ultra-processed products ( up ),dangerous,"The consumption of ultra-processed products (UP) is associated with many diseases in the adult, such as arterial hypertension, diabetes, or asthma."
wound,curcuma longa,safe,"Curcumin is a naturally occurring polyphenol found in Curcuma longa with multiple therapeutic properties, such as anti-inflammatory, wound healing and anti-cancer effects."
hypertension,apium graveolens,safe,"Apium graveolens L. is a traditional Chinese medicine prescribed as a treatment for hypertension, gout, and diabetes."
osteoporosis,tea,safe,"Tea drinking has positive effects on bone health and may prevent and treat osteoporosis, especially in older and postmenopausal women."
Prediabetes,Macaroni/Noodle/pasta/rice,can worsen,Macaroni/Noodle/pasta/rice with serving size 176.0g recorded in NHANES dietary data for Hypertension and Prediabetes patients.
cvd,fruits,safe,"CVD can be prevented by some simple and cost-effective steps such as smoking cessation, normalizing body weight, regular physical activity, and dietary changes, including decreasing saturated fats, increasing the intake of vegetables and fruits, and reducing sugar intake."
Hypertension,Crackers,can worsen,Crackers with serving size 30.0g recorded in NHANES dietary data for Hypertension and Prediabetes patients.
coronary heart disease,fruit,safe,Fruit and vegetable (FV) intake is recommended for the prevention of coronary heart disease (CHD).
blood stasis,red yeast rice,safe,Red yeast rice is a food fermentation product widely used to promote blood circulation and remove blood stasis.
food allergy,wheat,dangerous,"Food allergy is a common disease caused by the intake of allergen-containing foods, such as milk, eggs, peanuts, and wheat."
diabetic,sage,safe,Salvia officinalis L. (sage) is a medicinal plant used as an ingredient in foods and beverages and displays a wide range of biological and pharmacological activities including anti-diabetic effects.
stroke,morus alba,safe,Mulberry (Morus alba L.) leaves are widely used as herbal tea to prevent heat stroke.
hypertension,processed foods,dangerous,Increased consumption of processed foods in the modern world has contributed to a high salt intake and thus increased the prevalence of hypertension among Malaysian populations.
Hypertension,carrots/pumpkin/squash/sweet potato/,dangerous,carrots/pumpkin/squash/sweet potato/ is high in fat/sugar and may worsen hypertension.
cognitive decline,fruit,safe,"Finally, the limited epidemiological evidence available on fruit and vegetable consumption and cognition generally supported a protective role of these macronutrients against cognitive decline, dementia, and AD."
allergies,fruits,dangerous,"Recently, the prevalence of food allergies during childhood is increasing, with fruits being common allergens."
Prediabetes,Pancakes/waffles,can worsen,Pancakes/waffles with serving size 140.0g recorded in NHANES dietary data for Hypertension and Prediabetes patients.
gout,cherries,safe,"Cherries, which are rich in anti-inflammatory and antioxidative bioactive compounds, are proposed to be efficacious in preventing and treating gout, but recommendations to patients are conflicting."
anaemia,micronutrient powders,safe,"Home fortification with micronutrient powders (MNP) has been shown to reduce anaemia, with high overall acceptability and adherence, but there is limited evidence from West Africa."
ad,nutrition,safe,"Accumulating evidence suggests that nutrition (e.g., via fruit, vegetables, fish) is important for optimizing cognition and reducing risk of AD."
neurodegenerative diseases,fruits,safe,"Epidemiological studies have shown that consumption of diets rich in antioxidant and anti-inflammatory agents, such as those found in fruits and vegetables, may lower the risk of developing age-related neurodegenerative diseases such as Parkinson's disease and Alzheimer's disease."
urolithiasis,fruit,safe,"Regarding food, intake of fruit correlated negatively with the incidence of urolithiasis (r = -0.721, p = 0.008), while intake of eggs (r = 0.537, p = 0.072) and sugar (r = 0.475, p = 0.119) tended to positively correlate with incidence."
gut dysbiosis,fermented foods,safe,"Regular consumption of fermented foods (e.g., kimchi, kefir, etc.) may represent a potential avenue to counter the proinflammatory effects of gut dysbiosis."
ad,coffee beans,safe,"In addition, eicosanoyl-5-hydroxytryptamide (EHT), a naturally occurring component from coffee beans that modulates PP2A methylation, was shown to confer therapeutic benefits in rodent models of AD and Parkinson's disease."
allergic reaction,wheat,dangerous,"Wheat is a food allergen that occasionally causes a systemic allergic reaction; however, little is known about the quantities of wheat allergen required to evoke allergic symptoms."
allergy,wheat flour,dangerous,Occupational allergy to components of wheat flour is the main cause of rhinitis and asthma of workers in bakeries and similar activities.
neurodegenerative disease,green tea,safe,"Natural antioxidants from food sources and natural products such as resveratrol, curcumin, green tea polyphenols, and vitamin E are promising therapeutic agents in oxidative stress-mediated neurodegenerative disease as they have fewer adverse effects, more tolerable, cheaper, and sustainable for long term consumption."
dental caries,dietary sugar,dangerous,"Dietary sugar, especially in liquid form, increases risk of dental caries, adiposity, and type 2 diabetes."
allergy,cow's milk protein,dangerous,"Cow's milk protein allergy, which occurs in approximately 5-10% of the population of infants and children, has become an important public food safety problem."
allergy,milk,dangerous,"Although soy is considered a major food allergen (along with milk, egg, peanut, fish, and wheat), the prevalence of soy allergy in the pediatric population is not well defined."
Prediabetes,Macaroni/Noodle/pasta/rice,safe,Macaroni/Noodle/pasta/rice may support balanced diet for prediabetes.
liver cirrhosis,milk thistle extracts,safe,"Milk thistle extracts have been used as medicinal herbs in the treatment of liver cirrhosis, chronic hepatitis (liver inflammation), and gallbladder disorders."
cardiometabolic diseases,dairy products,dangerous,Dairy products contain both beneficial and harmful nutrients in relation to cardiometabolic diseases.
cardiovascular diseases,black mulberry fruits,safe,Black mulberry fruits are traditionally used in Uyghur folk medicine for the prevention and treatment of cardiovascular diseases in southern Xinjiang region of China.
obesity-linked metabolic diseases,blueberries,safe,"Blueberry consumption can prevent obesity-linked metabolic diseases, and it has been proposed that the polyphenol content of blueberries may contribute to these effects."
diabetic,beans,safe,"Common beans have been associated with anti-diabetic effects, due to its high content of bioactive compounds."
diabetic,cocoa,safe,Epidemiological and animal studies suggest that cocoa might reduce the risk of diabetic complications.
Hypertension,Bread,can worsen,Bread with serving size 25.0g recorded in NHANES dietary data for Hypertension and Prediabetes patients.
alzheimer's disease,ginger,safe,Ginger has been reportedly used for the management or treatment of Alzheimer's disease in folklore medicine.
cvds,blueberry,safe,"Moreover, substantial experimental studies have supported the protective role of fruits against CVDs, and several fruits (grape, blueberry, pomegranate, apple, hawthorn, and avocado) have been widely studied and have shown potent cardiovascular protective action."
murine collagen-induced arthritis,olive oil,safe,"Hydroxytyrosol acetate (HT-AC), a polyphenolic compound in olive oil, exerts an anti-inflammatory effect on murine collagen-induced arthritis."
Prediabetes,raw apple/apricot/avocado/banana/cantaloupe/cherries/fig/grapes/mango/pear/pineapple/,can worsen,raw apple/apricot/avocado/banana/cantaloupe/cherries/fig/grapes/mango/pear/pineapple/ with serving size 182.0g recorded in NHANES dietary data for Hypertension and Prediabetes patients.
obesity,dairy products,safe,"Efficiency of milk and dairy products in treatment of obesity, sclerosis and hypertension has been proved by DASH diet."
allergies,mustard,dangerous,"Peanuts and nuts cause a great part of allergies in the United States; in Spain and Portugal are commonly due to fish, milk; in Italy seafood and mustard in France."
hyperglycaemia,maslinic acid,safe,"Bredemolic acid (BA), an isomer of maslinic acid, has been reported to ameliorate the intermediate hyperglycaemia found in prediabetes; however, the effects of this triterpene on cardiovascular function have not yet been determined."
cancer,sword bean,safe,"Sword bean has been known as a traditional medicinal plant to treat cancer, sinus infection, and suppurative disease."
Prediabetes,oil,can worsen,oil with serving size 14.0g recorded in NHANES dietary data for Hypertension and Prediabetes patients.
Prediabetes,Beans,can worsen,Beans with serving size 28.4g recorded in NHANES dietary data for Hypertension and Prediabetes patients.
Hypertension,Beans,can worsen,Beans with serving size 28.4g recorded in NHANES dietary data for Hypertension and Prediabetes patients.
inflammatory diseases,taraxacum officinale,safe,"Taraxacum officinale (L.), commonly called dandelion has been used for centuries as a natural medicine to treat inflammatory diseases including some metabolic alterations associated with obesity."
osteoporosis,well-balanced diet,safe,"Health claims describe the relation between a food substance and the risk of disease, e.g., ""Adequate calcium and vitamin D throughout life, as part of a well-balanced diet, may reduce the risk of osteoporosis."
Prediabetes,butter,dangerous,butter is high in fat/sugar and may worsen prediabetes.
bronchiolitis obliterans,butter flavoring vapors,dangerous,"In 2000, inhalation of butter flavoring vapors was first associated with clinical bronchiolitis obliterans among workers in microwave popcorn production."
neurodegenerative diseases,fruits,safe,"Epidemiological studies have shown that consumption of diets rich in antioxidant and anti-inflammatory agents, such as those found in fruits and vegetables, may lower the risk of developing age-related neurodegenerative diseases such as Parkinson's disease and Alzheimer's disease."
