condition,food,warning,explanation
alzheimer's disease,docosahexaenoic acid,safe,"Docosahexaenoic acid (DHA) is a fatty acid abundant in the brain, and is reported to have protective effects against Alzheimer's disease, although the mechanistic effects of DHA against Alzheimer's pathophysiology remain unclear."
asthma,aerosolized crab allergens,dangerous,Aerosolized crab allergens are suspected etiologic agents for asthma among crab-processing workers.
obesity,diets with high fat and carbohydrate content,dangerous,"Among other factors, diets with high fat and carbohydrate content have been implicated in obesity."
metabolic disorders,eicosapentaenoic acid,safe,"Dietary n-3 fatty acids, especially of marine origin, eicosapentaenoic acid (20:5n-3) and docosahexaenoic acid (22:6n-3), have always been lauded for their profound effects on regulating the risk factors for major metabolic disorders."
atopic dermatitis,hard water,safe,"This review summarizes the mechanism and effects of Dead Sea salt, hard water, commercial baby cleansers, oatmeal, rice, and natural oils as bathing additives for the treatment of atopic dermatitis."
Hypertension,egg,safe,egg may support balanced diet for hypertension.
inflammation,chicken protein hydrolysates ( cphs ),safe,Chicken protein hydrolysates (CPHs) generated from rest raw materials through enzymatic hydrolysis using Corolase PP or Alcalase were shown to reduce inflammation and stimulate hepatic mitochondrial fatty acid oxidation in high-fat-fed mice.
vcind,vegetable-based diet,safe,"A high level of education, manual-work, low level of alcohol use, regular health checks, a vegetable-based diet, and more fruit and milk were protective factors for VCIND."
bronchitis,flour,dangerous,"Symptoms suggestive of chronic bronchitis or chronic productive cough were found in 29.0% of 100 workers exposed to flour dust in a flour mill, 26.0% presenting with chronic cough and 29.0% with phlegm."
hyperglycemia,capsicum,safe,All evaluated pepper (Capsicum) genus exhibited both anti-hyperglycemia and anti-hypertension potential.
autoimmune diseases,processed foods,dangerous,"Among these, dietary habits, and especially an excessive salt, typical of processed foods, has been implicated in the development of autoimmune diseases."
Prediabetes,Beans,can worsen,Beans with serving size 28.4g recorded in NHANES dietary data for Hypertension and Prediabetes patients.
Hypertension,Nuts,can worsen,Nuts with serving size 28.4g recorded in NHANES dietary data for Hypertension and Prediabetes patients.
cognitive decline,wine,safe,Some studies have shown a potential role for grapes or wine in slowing cognitive decline and other effects of aging.
cardiovascular disorders,diets rich in (poly)phenols,safe,Diets rich in (poly)phenols are associated with a reduced reduction in the incidence of cardiovascular disorders.
ailments,punica granatum,safe,Over one thousand cultivars of Punica granatum (Punicaceae) are known and some are traditionally used to treat various ailments.
knee osteoarthritis,avocado soybean unsaponifiables (asu),safe,"Avocado soybean unsaponifiables (ASU) has proven its safety and effectiveness in clinical studies of knee osteoarthritis (OA); however, whether ASU exerts structure-modifying effects is still to be elucidated."
respiratory allergy,flour,dangerous,"Out of the 314 subjects tested, 22 (7%) had a respiratory allergy against flour (flour rhinitis and/or flour asthma), and 21 (6.7%) a preexistent atopic disease without actual symptoms of flour allergy."
Hypertension,puerto rican style food,safe,puerto rican style food may support balanced diet for hypertension.
dementia,fruit of alpinia oxyphylla,safe,The fruit of Alpinia oxyphylla is often used in traditional Chinese medicine to treat dementia and memory defects.
allergic,cabbage,safe,"Quercetin is the major polyphenolic flavonoid found in food products, including berries, apples, cauliflower, tea, cabbage, nuts, and onions that have traditionally been treated as anticancer and antiviral, and used for the treatment of allergic, metabolic, and inflammatory disorders, eye and cardiovascular diseases, and arthritis."
pain,curcuma longa,safe,"Turmeric (Curcuma longa) has traditionally been used to treat pain, fever, allergic and inflammatory diseases such as bronchitis, arthritis, and dermatitis."
Prediabetes,raw apple/apricot/avocado/banana/cantaloupe/cherries/fig/grapes/mango/pear/pineapple/,safe,raw apple/apricot/avocado/banana/cantaloupe/cherries/fig/grapes/mango/pear/pineapple/ may support balanced diet for prediabetes.
cardiovascular disease,ultra-processed foods,dangerous,A high percentage of total calories from ultra-processed foods has been associated with several cardiovascular disease risk factors.
cancer,psidium guajava,safe,"Psidium Guajava is a promising functional food against cancer, owing to a variety of bioactive compounds."
baker's rhinitis,wheat,dangerous,Baker's rhinitis is a kind of occupational allergic rhinitis mainly caused by intranasal exposure to wheat and/or rye flour in bakery workers.
asthma,flour,dangerous,Asthma could be induced by inhaled flour or by exposure to allergens present in bakery products.
Hypertension,Fish,safe,Fish is nutritious and may help manage hypertension.
ad,salt,dangerous,"Diets characterized by high intakes of refined sugars, salt, animal-derived proteins and fats and by low intakes of fruit and vegetables are associated with a higher risk of AD and can perturb the circadian modulation of cortisol secretion, which is associated with poor sleep quality."
Prediabetes,fruit juice,safe,fruit juice is nutritious and may help manage prediabetes.
neurodegenerative diseases,eicosapentaenoic acid,safe,"Omega-3 polyunsaturated fatty acids (n-3 PUFAs), docosahexaenoic acid (DHA) and eicosapentaenoic acid (EPA), have been reported to prevent neurodegenerative diseases such as Alzheimer's disease (AD) in both experimental and clinical/epidemiological studies."
Hypertension,Burrito/Taco/Enchilada/Pizza/lasanga,safe,Burrito/Taco/Enchilada/Pizza/lasanga may support balanced diet for hypertension.
Hypertension,"Meat substitute, cereal- and vegetable protein-based, fried",dangerous,"Meat substitute, cereal- and vegetable protein-based, fried is high in fat/sugar and may worsen hypertension."
occupational diseases,flour,dangerous,Bakers are exposed daily to flour and may be susceptible to immunologic occupational diseases.
Prediabetes,Lamb/Goat/Veal/Venison,safe,Lamb/Goat/Veal/Venison may support balanced diet for prediabetes.
cardiovascular disease,ginseng,safe,"Ginsenoside-Rb1 (Rb1), a major active component of ginseng, has many benefits for cardiovascular disease and diabetes mellitus (DM), but the effect and mechanism on diabetic cardiomyopathy are not clear."
cognitive impairment,soybean curd,dangerous,"Paradoxically, the Honolulu Asia Aging Study reported an increased risk for cognitive impairment and other dementia markers with high tofu (soybean curd) intake."
systolic blood pressure,watermelon,safe,"Consumption of watermelon has been associated with beneficial effects on metabolism, including reductions in systolic blood pressure, improved fasting blood glucose levels, and changes in hepatic metabolite accumulation."
Prediabetes,egg omelet,can worsen,egg omelet with serving size 61.0g recorded in NHANES dietary data for Hypertension and Prediabetes patients.
bmd,inadequate diet,safe,"Inadequate diet, which may occur in depressed individuals prescribed SSRIs is also associated with decreased BMD."
Prediabetes,Chicken/Turkey,can worsen,Chicken/Turkey with serving size 110.0g recorded in NHANES dietary data for Hypertension and Prediabetes patients.
gastrointestinal perforation,steroids,dangerous,"The causes of gastrointestinal perforation with collagen diseases have been reported to be functional gastrointestinal disorders with collagen diseases like amyloidosis, gastrointestinal infections in immunocompromised patients, and side effects of medication, such as steroids or NSAIDs and MTX."
airway obstruction,milk,safe,"The hypothesis that vitamin A, or foods rich in vitamin A such as milk, protects against the development of airway obstruction was tested in a subsample of data from the 1971-1975 National Health and Nutrition Examination Survey."
hyperglycemia,capsicum,safe,All evaluated pepper (Capsicum) genus exhibited both anti-hyperglycemia and anti-hypertension potential.
memory deficits,green tea from camellia sinensis,safe,"Green tea from Camellia sinensis plays a neuroprotective role in different neurodegenerative conditions, such as memory deficits in Alzheimer disease (AD)."
fatigue,citrus unshiu,safe,"Citrus unshiu (Rutaceae) is an easy-peeling citrus fruit, which has been used as a traditional Korean medicine for improving skin elasticity, relieving fatigue and cough, and preventing bronchitis, flu, and various cancers."
inflammation,beer,safe,"We previously demonstrated that the consumption of iso-ÃÂÃÂ±-acids (IAA), the hop-derived bitter compounds in beer, prevents inflammation and Alzheimer's disease pathology in model mice."
myxomatous mitral valve disease,fish oil,safe,"A cardiac protection blend (CPB) of nutrients including medium chain triglycerides, fish oil and other key nutrients was developed to slow the progression of canine myxomatous mitral valve disease (MMVD)."
dyspepsia,cinnamomum,safe,"Cinnamomum cassia (C. cassia, Lauraceae family), commonly used for treating dyspepsia, gastritis, blood circulation, and inflammatory diseases is considered as one of the 50 fundamental herbs in traditional Chinese medicine."
Hypertension,sugar/desserts,dangerous,sugar/desserts is high in fat/sugar and may worsen hypertension.
nausea,ginger,safe,Vitamin B6 and ginger are both effective for nausea and vomiting in early pregnancy.
vascular damage,plant-based foods and beverages,safe,"Flavonoids, compounds found in plant-based foods and beverages, might ameliorate vascular damage and atherosclerosis."
bronchitis,flour,dangerous,"Symptoms suggestive of chronic bronchitis or chronic productive cough were found in 29.0% of 100 workers exposed to flour dust in a flour mill, 26.0% presenting with chronic cough and 29.0% with phlegm."
cardiovascular disease,chocolate,safe,Three recent meta-analyses found significant prospective inverse associations between chocolate intake and cardiovascular disease risk.
inflammation,mediet,safe,"Several clinical, epidemiological and experimental evidences suggest that consumption of the MeDiet reduces the incidence of certain pathologies related to oxidative stress, chronic inflammation and immune system diseases such as cancer, atherosclerosis and cardiovascular disease (CVD)."
airway obstruction,milk,safe,"The hypothesis that vitamin A, or foods rich in vitamin A such as milk, protects against the development of airway obstruction was tested in a subsample of data from the 1971-1975 National Health and Nutrition Examination Survey."
vomiting,oryza sativa,safe,"Oryza sativa L. is consumed globally as a staple food, and its roots have been used as a Korean and Chinese medical supplement for protection of the stomach and lungs and for amelioration of vomiting and fever."
Hypertension,beet greens/collards/cress/romaine/greens/spinach,safe,beet greens/collards/cress/romaine/greens/spinach may support balanced diet for hypertension.
Prediabetes,Macaroni/Noodle/pasta/rice,safe,Macaroni/Noodle/pasta/rice may support balanced diet for prediabetes.
Prediabetes,Stew (meat/rice/vegetable),can worsen,Stew (meat/rice/vegetable) with serving size 140.0g recorded in NHANES dietary data for Hypertension and Prediabetes patients.
Hypertension,Pork,dangerous,Pork is high in fat/sugar and may worsen hypertension.
chronic diseases,oats,safe,Oats products are believed to contain many bioactives that possess potential beneficial properties against chronic diseases.
cardiovascular disease,malnutrition,dangerous,"Malnutrition is a condition most commonly arising from the inadequate consumption of nutrients necessary to maintain physiological health and is associated with the development of cardiovascular disease, osteoporosis, and sarcopenia."
Hypertension,Cereal,safe,Cereal may support balanced diet for hypertension.
Hypertension,fruit and vegetable smoothie,can worsen,fruit and vegetable smoothie with serving size 233.0g recorded in NHANES dietary data for Hypertension and Prediabetes patients.
knee osteoarthritis,milk consumption,safe,Observational studies showed inverse associations between milk consumption and knee osteoarthritis (knee OA).
bmd,inadequate diet,safe,"Inadequate diet, which may occur in depressed individuals prescribed SSRIs is also associated with decreased BMD."
coeliac disease,wheat,dangerous,"Wheat is one of the major crops grown, processed and consumed by humankind and is associated with both intolerances (notably coeliac disease) and allergies."
cancers,allium,safe,Many epidemiological studies support the protective role of garlic and related allium foods against the development of certain human cancers.
Prediabetes,carrots/pumpkin/squash/sweet potato/,can worsen,carrots/pumpkin/squash/sweet potato/ with serving size 72.0g recorded in NHANES dietary data for Hypertension and Prediabetes patients.
alzheimer's disease,coffee,safe,Several epidemiological and preclinical studies supported the protective effect of coffee on Alzheimer's disease (AD).
gut dysbiosis,fermented foods,safe,"Regular consumption of fermented foods (e.g., kimchi, kefir, etc.) may represent a potential avenue to counter the proinflammatory effects of gut dysbiosis."
Hypertension,Cream,can worsen,Cream with serving size 32.0g recorded in NHANES dietary data for Hypertension and Prediabetes patients.
ischemic heart disease,fish,safe,"The low mortality rates from ischemic heart disease and cancer are thought to reflect the low prevalence of obesity in Japan; low intake of red meat, specifically saturated fatty acids; and high intakes of fish, specifically n-3 polyunsaturated fatty acids, plant foods such as soybeans, and nonsugar-sweetened beverages such as green tea."
inflammatory diseases,taraxacum officinale,safe,"Taraxacum officinale (L.), commonly called dandelion has been used for centuries as a natural medicine to treat inflammatory diseases including some metabolic alterations associated with obesity."
Hypertension,Beef,dangerous,Beef is high in fat/sugar and may worsen hypertension.
anaemia,iron rich foods,safe,"Improving overall household living conditions, increasing maternal education, delaying childbearing and introducing iron rich foods at six months of age may reduce the likelihood of anaemia in toddlerhood."
Prediabetes,dried fruit,can worsen,dried fruit with serving size 28.4g recorded in NHANES dietary data for Hypertension and Prediabetes patients.
alzheimer's disease,docosahexaenoic acid,safe,"Docosahexaenoic acid (DHA) is a fatty acid abundant in the brain, and is reported to have protective effects against Alzheimer's disease, although the mechanistic effects of DHA against Alzheimer's pathophysiology remain unclear."
asthmatic reactions,flour,dangerous,"Bronchial provocation tests by ""occupational"" exposure to flour provoked dual asthmatic reactions accompanied by rhinitis in two atopic bakers engaged in the manufacture of bread and pies."
hyperglycemia,honeybush tea,safe,These results imply that the sequential extracts of honeybush tea (particularly the aqueous and ethyl acetate extracts) may not only exhibit antioxidant potentials but also mediate anti-hyperglycemia activities by inhibiting lipid and carbohydrate digestion.
degenerative diseases,fruits,safe,"Several studies have shown that a high consumption of vegetables and fruits is consistently associated with a low risk of oxidative stress-induced diseases, which includes some degenerative diseases such as amyotrophic lateral sclerosis, Alzheimer and Parkinson."
myocardial infarction,traditional italian diet,safe,"Between 1935 and 1965, the Italian-American inhabitants of Roseto (Pennsylvania, USA) observed a traditional Italian diet and maintained half the mortality rates from myocardial infarction compared with neighboring cities."
colon neoplastic lesions,garlic,safe,Diallyl disulfide (DADS) is a major organosulphur compound present in garlic with an anti-mitotic potential against colon neoplastic lesions in vivo and colon tumour cell growth in vitro.
allergy,rice,dangerous,"In rice allergy, proteins with molecular masses of 14-16, 26, 33, and 56 kDa have been demonstrated to be potentially allergenic."
Prediabetes,Seeds,safe,Seeds may support balanced diet for prediabetes.
cardiovascular mortality,glycemic load (gl) diet,dangerous,Recent epidemiologic studies have found that a high glycemic index (GI) and glycemic load (GL) diet are associated with a higher risk for metabolic complications and cardiovascular mortality.
airway obstruction,milk,safe,"The hypothesis that vitamin A, or foods rich in vitamin A such as milk, protects against the development of airway obstruction was tested in a subsample of data from the 1971-1975 National Health and Nutrition Examination Survey."
nephrolithiasis,fruits,safe,"Dietary Approaches to Stop Hypertension (DASH), a low-sodium and fruits/vegetables-rich diet, has been associated with a lower risk of nephrolithiasis, due to altered urinary biochemistry."
pain,raspberries,safe,"In this context, commonly available fruits, such as blueberries, raspberries and strawberries, and pomegranates have shown promising results in reducing pain and inflammation in experimental models and in human clinical studies of arthritis."
Hypertension,egg,can worsen,egg with serving size 50.0g recorded in NHANES dietary data for Hypertension and Prediabetes patients.
ad,beer,safe,"High levels of consumption (>92 times/month) of fermented foods such as doenjang, chungkookjang, kimchi, fermented seafood, makgeolli, and beer were associated with a lower prevalence of AD (OR, 0.56; 95% confidence interval [CI], 0.37-0.84)."
dyspepsia,cinnamomum,safe,"Cinnamomum cassia (C. cassia, Lauraceae family), commonly used for treating dyspepsia, gastritis, blood circulation, and inflammatory diseases is considered as one of the 50 fundamental herbs in traditional Chinese medicine."
rhythm disorders,added salt,dangerous,"Saturated fat, added salt, and excessive energy drink consumption appear to be harmful for patients with rhythm disorders."
ad,peanut oil,safe,"Some bath oils and skin creams used for treating AD contain peanut oil, and it has been suggested that exposure to peanut allergens through a disrupted skin barrier is a potential cause of PA."
alzheimer's disease,lemon,safe,"Therefore, this study presents the neuroprotective potentials of lemon and tangerine peels-derived EOs, and the possibility of their exploration as neuroactive agents and alternative in the management of Alzheimer's disease (AD)."
Hypertension,Beef,can worsen,Beef with serving size 65.0g recorded in NHANES dietary data for Hypertension and Prediabetes patients.
anaphylaxis,peanut,dangerous,Peanut allergy affects 3% of Australian children and has a higher risk of anaphylaxis than most food allergies.
stroke,olive oil,safe,"A Cretan Mediterranean diet, high in olive oil, whole grains, fruits, vegetables and legumes, and low in cholesterol and saturated fat, can reduce stroke by 40% or more in high-risk patients."
Hypertension,Chicken/Turkey,safe,Chicken/Turkey may support balanced diet for hypertension.
skin inflammation,star anise,safe,"f. (star anise) has been used in traditional medicine for treatment of skin inflammation, rheumatism, asthma, and bronchitis."
cardiovascular diseases,fruit,safe,Fruit and vegetable intake has been reported as one of the significant protective factors against the development of cardiovascular diseases (CVD).
dermatitis,onion,dangerous,"Onion (Allium cepa) handling can induce contact dermatitis, rhinoconjunctivitis and asthma."
Prediabetes,milk,can worsen,milk with serving size 244.0g recorded in NHANES dietary data for Hypertension and Prediabetes patients.
Hypertension,tomato/salsa/,safe,tomato/salsa/ may support balanced diet for hypertension.
Prediabetes,Burrito/Taco/Enchilada/Pizza/lasanga,safe,Burrito/Taco/Enchilada/Pizza/lasanga may support balanced diet for prediabetes.
Hypertension,puerto rican style food,safe,puerto rican style food may support balanced diet for hypertension.
cancer,allium,safe,"Allium vegetables have been shown to have beneficial effects against several diseases, including cancer."
liver cirrhosis,milk thistle extracts,safe,"Milk thistle extracts have been used as medicinal herbs in the treatment of liver cirrhosis, chronic hepatitis (liver inflammation), and gallbladder disorders."
diabetes,breadfruit,safe,Breadfruit is a traditional staple crop from Pacific islands with the potential to improve worldwide food security and mitigate diabetes.
Hypertension,tomato/salsa/,safe,tomato/salsa/ may support balanced diet for hypertension.
asthma,garlic,dangerous,"Twenty-three positive bronchial or nasal challenges were performed on 16 patients (six farmers, six bakery workers, and four food industry workers) and asthma or rhinitis was diagnosed as caused by cereal flour or grain, cow epithelium, storage mites, garlic, or soy dust."
low-grade inflammation,diet,safe,"Low-grade inflammation is a suggested mechanism in the development of metabolic syndrome (MetS), and diet could act as a regulator."
obesity,ginger,safe,Ginger exerts protective effects on obesity and its complications.
neurodegenerative disorders,extra virgin olive oil,safe,"In the central nervous system (CNS), extra virgin olive oil (EVOO) produces interesting effects against neurodegenerative disorders including Alzheimer's disease (AD)."
flagellate dermatitis,shiitake mushrooms,dangerous,Flagellate dermatitis caused by the intake of shiitake mushrooms is characterized by linear erythematous lesions that are intensely pruritic.
human ailments,ginger,safe,"Besides its food-additive functions, ginger has a long history of medicinal use for the treatment of a variety of human ailments including common colds, fever, rheumatic disorders, gastrointestinal complications, motion sickness, diabetes, cancer, etc."
type 2 diabetes mellitus,healthy diets,safe,It is hypothesized that decreased advanced glycation end products (AGEs) levels could affect type 2 diabetes mellitus (T2DM) remission in newly diagnosed patients through the consumption of two healthy diets.
Hypertension,shakes/drink mixes,safe,shakes/drink mixes may support balanced diet for hypertension.
respiratory tract infections,lemon,safe,"Natural products like ginger, turmeric, garlic, onion, cinnamon, lemon, neem, basil, and black pepper have been scientifically proven to have therapeutic benefits against acute respiratory tract infections including pulmonary fibrosis, diffuse alveolar damage, pneumonia, and acute respiratory distress syndrome, as well as associated septic shock, lung and kidney injury, all of which are symptoms associated with COVID-19 infection."
hyperglycemia,honeybush tea,safe,These results imply that the sequential extracts of honeybush tea (particularly the aqueous and ethyl acetate extracts) may not only exhibit antioxidant potentials but also mediate anti-hyperglycemia activities by inhibiting lipid and carbohydrate digestion.
anemia deficiency,glycine max,safe,"Glycine max is commonly used in Algeria for treatment of anemia deficiency and osteoporosis, it ranks first in terms of vegetal proteins."
Hypertension,butter,can worsen,butter with serving size 14.2g recorded in NHANES dietary data for Hypertension and Prediabetes patients.
Prediabetes,egg,can worsen,egg with serving size 50.0g recorded in NHANES dietary data for Hypertension and Prediabetes patients.
cerebrovascular disease,salt,dangerous,"The decreasing mortality rates from cerebrovascular disease are thought to reflect the increases in animal foods, milk, and dairy products and consequently in saturated fatty acids and calcium, together with a decrease in salt intake which may have led to a decrease in blood pressure."
Hypertension,Ice Cream,dangerous,Ice Cream is high in fat/sugar and may worsen hypertension.
chills,capsinoids from nonpungent chili pepper,safe,"Capsinoids from nonpungent chili pepper cultivar have been reported to reduce body fat mass, promote metabolism, and improve unidentified complaints of chills."
cerebrovascular disease,salt,dangerous,"The decreasing mortality rates from cerebrovascular disease are thought to reflect the increases in animal foods, milk, and dairy products and consequently in saturated fatty acids and calcium, together with a decrease in salt intake which may have led to a decrease in blood pressure."
tumour,docosahexaenoic acid,safe,Docosahexaenoic acid (DHA) has been shown to reduce tumour growth in preclinical models when combined with chemotherapy and is known to beneficially modulate systemic immune function.
allergies,fruits,dangerous,"Recently, the prevalence of food allergies during childhood is increasing, with fruits being common allergens."
Hypertension,Cream,dangerous,Cream is high in fat/sugar and may worsen hypertension.
dyspepsia,cinnamomum,safe,"Cinnamomum cassia (C. cassia, Lauraceae family), commonly used for treating dyspepsia, gastritis, blood circulation, and inflammatory diseases is considered as one of the 50 fundamental herbs in traditional Chinese medicine."
colon cancer,garlic,safe,"The results indicate that grape, soybean, green tea, garlic, olive, and pomegranate are the most effective plants against colon cancer."
inflammation,olea europaea,safe,Bioactive extracts from Olea europaea have anti-inflammatory activity and have been shown to reduce systemic inflammation in other animal models.
