condition,food,warning,explanation
cardiovascular disease,soy foods,safe,"Epidemiological investigations have shown that consumption of soybeans or soy foods reduces the risk of the development of cardiovascular disease, cancer and osteoporosis."
Hypertension,raw apple/apricot/avocado/banana/cantaloupe/cherries/fig/grapes/mango/pear/pineapple/,safe,raw apple/apricot/avocado/banana/cantaloupe/cherries/fig/grapes/mango/pear/pineapple/ may support balanced diet for hypertension.
cancer,garlic intake,safe,Numerous animal and in vitro studies provided evidence for a relation between garlic intake and cancer risk reduction.
Hypertension,Cheese,can worsen,Cheese with serving size 32.0g recorded in NHANES dietary data for Hypertension and Prediabetes patients.
osteoporosis,chicken meat,safe,Proteins and peptides in chicken meat and bones are known for being rich in functional and nutritional ingredients for the improvement of osteoporosis.
chronic diseases,beer,safe,"In beer, the variety and concentration of bioactive compounds in the non-alcoholic fraction suggests that its consumption at moderate levels may not only be harmless but could also positively contribute to an improvement of certain physiological states and be also useful in the prevention of different chronic diseases."
epilepsy,ketogenic diet,safe,"First identified as a feasible treatment for intractable epilepsy, the ketogenic diet (KD) has recently gained popularity thanks to growing evidence on applications such as weight loss, most importantly, but also NAFLD, cancer, neurologic conditions and chronic pain."
Prediabetes,Biscuits,safe,Biscuits may support balanced diet for prediabetes.
hyperglycemia,zingiber officinale,safe,"[6]-Gingerol, a major component of Zingiber officinale, was previously reported to ameliorate hyperglycemia in type 2 diabetic mice."
chd,food rich in saturated fat,dangerous,"The basis of this recommendation is the 'diet-heart hypothesis', which postulates that consumption of food rich in saturated fat increases serum cholesterol levels, which increases risk of CHD."
allergic reactions,rice,dangerous,Allergen Glb33 is an important allergen in rice that can cause allergic reactions such as asthma and atopic dermatitis.
bone disease,mediterranean diet,safe,Mediterranean diet (MD) has shown to prevent bone disease.
ischemic heart disease,mediterranean diet,safe,"With the famous Seven Countries Study, Keys demonstrated for the first time that populations practicing a Mediterranean diet - such as the Greeks and southern Italians - showed low mortality rates from ischemic heart disease compared to the peoples of Northern Europe and North America."
type ii diabetes,processed meat,dangerous,"The intake of processed meat has been associated with several adverse health outcomes such as type II diabetes and cancer; however, the mechanisms are not fully understood."
ra,gastrointestinal ( gi ) protective drugs,safe,Patients with RA commonly use gastrointestinal (GI) protective drugs for treatment and prevention of drug-associated GI injuries.
musculoskeletal diseases,fruit of lycium chinense (lc),safe,"The fruit of Lycium chinense (LC), one of the most popular natural materials, has been used to counter the effects of musculoskeletal diseases in oriental medicine."
brain disorders,beer,safe,"Beer, as part of this protective diet, contains compounds such as silicon and hops that could play a major role in preventing brain disorders."
Hypertension,grapefruit/lemon/orange,can worsen,grapefruit/lemon/orange with serving size 236.0g recorded in NHANES dietary data for Hypertension and Prediabetes patients.
osteoporotic fractures,virgin olive oil,safe,"Virgin olive oil, a key component of the Mediterranean Diet (MDiet), with recognised beneficial effects on metabolism and cardiovascular health, may decrease the risk of osteoporotic fractures."
neurodegenerative diseases,coffee,safe,"Our findings strongly suggest that some foods, especially coffee, can act as a rich source of ÃÂÃÂ²-carbolines, which may possibly be associated with a reduced risk for serious neurodegenerative diseases, such as Parkinson's and Alzheimer's."
Prediabetes,Pork,can worsen,Pork with serving size 84.0g recorded in NHANES dietary data for Hypertension and Prediabetes patients.
hepatic damage of diabetes,grape seed procyanidin b2 ( gspb2 ),safe,Our previous studies have verified that grape seed procyanidin B2 (GSPB2) played a protective effect on hepatic damage of diabetes.
wound,curcuma longa,safe,"Curcumin is a naturally occurring polyphenol found in Curcuma longa with multiple therapeutic properties, such as anti-inflammatory, wound healing and anti-cancer effects."
Hypertension,Cheese,safe,Cheese may support balanced diet for hypertension.
allergy,hydrolyzed wheat products,dangerous,There are several reports describing allergy to hydrolyzed wheat products.
myocardial infarction,extra virgin olive oil,safe,"In this context, extra virgin olive oil (EVOO), the most representative component of this diet, seems to be relevant in lowering the incidence of cardiovascular events, including myocardial infarction and stroke."
Prediabetes,oil,safe,oil may support balanced diet for prediabetes.
neural tube defects,folic acid fortification,safe,There is no doubt that folic acid fortification can be effective for reducing the incidence of neural tube defects.
allergy,cow's milk protein,dangerous,"Cow's milk protein allergy, which occurs in approximately 5-10% of the population of infants and children, has become an important public food safety problem."
Prediabetes,Nuts,can worsen,Nuts with serving size 28.4g recorded in NHANES dietary data for Hypertension and Prediabetes patients.
Prediabetes,tomato/salsa/,can worsen,tomato/salsa/ with serving size 123.0g recorded in NHANES dietary data for Hypertension and Prediabetes patients.
Prediabetes,butter,dangerous,butter is high in fat/sugar and may worsen prediabetes.
skin inflammation,fish oil,safe,Nutritional supplementation with fish oil or ÃÂÃÂ-3 (n-3) polyunsaturated fatty acids (PUFAs) has potential benefits for skin inflammation.
coronary heart diseases,excessive consumption of red meat,dangerous,Excessive consumption of red meat is associated with various diseases including coronary heart diseases and cancer.
diabetes,diet,safe,"Prevention of diabetes through the diet has recently received an increasing interest, and polyphenolic compounds, such as flavanols, have become important potential chemopreventive natural agents due to their proved benefits on health, with low toxicity and cost."
bladder cancer,tobacco,dangerous,Tobacco smoking and occupational exposure to aromatic amines are the two major established environmental risk factors for bladder cancer.
joints pain,sesame oil,safe,Sesame oil is an herbal product that has been used to treat the joints pain in several traditional medicines.
urinary tract stones,millet,dangerous,"The predominant urinary tract stones in the tribal Satpura belt are bladder stones and may be related to poor nutrition, low socioeconomic status and consumption of bajra (millet) as staple food as found in this region (93.5%)."
cardiovascular diseases,black mulberry fruits,safe,Black mulberry fruits are traditionally used in Uyghur folk medicine for the prevention and treatment of cardiovascular diseases in southern Xinjiang region of China.
allergy,nickel,dangerous,Nickel is the most common cause of contact allergy in the general population and the most frequently detected allergen in patients patch tested for suspected allergic contact dermatitis (ACD).
memory impairment,tomato fruit,safe,"ÃÂÃÂ²-Amyrin, an ingredient of the surface wax of tomato fruit and dandelion coffee, is previously reported to ameliorate memory impairment induced by cholinergic dysfunction."
cvd,cocoa,safe,"The consumption of natural polyphenol-rich foods, and cocoa in particular, has been related to a reduced risk of CVD, including coronary heart disease and stroke."
cancer,sword bean,safe,"Sword bean has been known as a traditional medicinal plant to treat cancer, sinus infection, and suppurative disease."
alzheimer's disease,caffeic acid,safe,"Caffeic acid (CA) has shown neuroprotection in Alzheimer's disease or cerebral ischaemia; however, it is unclear whether CA confers neuroprotection in ÃÂÃÂ±-synuclein-induced PD models."
glycemic,bread,dangerous,"Bread is a staple food for majority of the people worldwide, but it has a high glycemic effect."
skin inflammation,star anise,safe,"f. (star anise) has been used in traditional medicine for treatment of skin inflammation, rheumatism, asthma, and bronchitis."
vd,tea,safe,"A high educational level, a vegetable-based diet, and tea were protective factors for VD."
skin inflammation,fish oil,safe,Nutritional supplementation with fish oil or ÃÂÃÂ-3 (n-3) polyunsaturated fatty acids (PUFAs) has potential benefits for skin inflammation.
allergy,fruits,dangerous,Severe allergy to fruits mediated by a 7 kDa allergen belonging to the gibberellin-regulated protein (GRP) family is known to be associated with Cupressaceae pollinosis.
Hypertension,butter,can worsen,butter with serving size 14.2g recorded in NHANES dietary data for Hypertension and Prediabetes patients.
alzheimer's disease,docosahexaenoic acid,safe,"Docosahexaenoic acid (DHA) is a fatty acid abundant in the brain, and is reported to have protective effects against Alzheimer's disease, although the mechanistic effects of DHA against Alzheimer's pathophysiology remain unclear."
respiratory symptoms,flour,dangerous,Flour mill workers are at high risk of developing respiratory symptoms due to exposure to flour dust in their working environment.
cardiovascular disease,soy foods,safe,"Epidemiological investigations have shown that consumption of soybeans or soy foods reduces the risk of the development of cardiovascular disease, cancer and osteoporosis."
dementia,nobiletin from citrus peels,safe,"Previously, we identified nobiletin from citrus peels as a natural compound possessing anti-dementia activity."
cd,fish oil,safe,Fish oil rich in eicosapentaenoic acid (EPA) and docosahexaenoic acid (DHA) reduces disease activity in patients with CD with raised laboratory markers of inflammation and in healthy subjects alters PBMC function.
Prediabetes,salad dressing,can worsen,salad dressing with serving size 14.0g recorded in NHANES dietary data for Hypertension and Prediabetes patients.
cardiovascular disease,ultra-processed foods,dangerous,A high percentage of total calories from ultra-processed foods has been associated with several cardiovascular disease risk factors.
atherosclerosis,nuts,safe,"Thus, the inclusion of food sources of dietary antioxidants, such as different kinds of nuts, may improve biomarkers related to oxidative stress, contributing to a possible reduction in atherosclerosis progression."
Hypertension,dried fruit,safe,dried fruit is nutritious and may help manage hypertension.
colorectal cancer,garlic supplements,safe,"Laboratory studies have provided evidence that allium vegetables and garlic supplements might protect against colorectal cancer (CRC), but epidemiologic studies have produced inconsistent findings."
Hypertension,salad dressing,can worsen,salad dressing with serving size 14.0g recorded in NHANES dietary data for Hypertension and Prediabetes patients.
neurodegenerative diseases,unbalanced diet,dangerous,"In the last decade, several theories investigating the causes of neurodegenerative diseases have been formulated and a condition or risk factor that can contribute is described by the gut-brain axis hypothesis: stress, unbalanced diet, and drugs impact altering microbiota composition which contributes to dysbiosis."
cardiometabolic diseases,dairy products,dangerous,Dairy products contain both beneficial and harmful nutrients in relation to cardiometabolic diseases.
Prediabetes,Burrito/Taco/Enchilada/Pizza/lasanga,can worsen,Burrito/Taco/Enchilada/Pizza/lasanga with serving size 198.0g recorded in NHANES dietary data for Hypertension and Prediabetes patients.
alzheimer's disease,extra-virgin olive oil,safe,Previous evidence suggested that extra-virgin olive oil (EVOO) is linked to attenuating amyloid-ÃÂÃÂ² (AÃÂÃÂ²) pathology and improving cognitive function in Alzheimer's disease (AD) mouse models.
allergies,milk,dangerous,"Allergies to peanuts are particularly worrisome as unlike allergies to other allergenic foods, such as milk and egg, which are commonly outgrown by 5 or 10 years of age, 80% of peanut allergies persist into adulthood."
chronic diseases,milk,safe,"Milk and milk product intake is associated with better diet quality and has been associated with a reduced risk of chronic diseases or conditions including hypertension, cardiovascular disease, metabolic syndrome, Type 2 Diabetes and osteoporosis."
Prediabetes,sugar/desserts,dangerous,sugar/desserts is high in fat/sugar and may worsen prediabetes.
allergic,pistachio,dangerous,"Pistachio and cashew contain allergenic proteins, which causes them to be removed from the diet of allergic people."
murine collagen-induced arthritis,olive oil,safe,"Hydroxytyrosol acetate (HT-AC), a polyphenolic compound in olive oil, exerts an anti-inflammatory effect on murine collagen-induced arthritis."
cancer,oolong tea,safe,"Evidence regarding the health benefits of oolong tea consumption is accumulating, and tea polyphenols have various pharmacological properties such as anti-cancer and anti-diabetes effects."
neurological diseases,cigarette smoke,dangerous,"Exposure to cigarette smoke (CS) is associated with an increased risk of several neurological diseases such as stroke, Alzheimer's disease, and dementia."
cvds,fruits,safe,Accumulating epidemiological studies have indicated that consuming fruits was inversely related to the risk of CVDs.
Hypertension,Chicken/Turkey,can worsen,Chicken/Turkey with serving size 110.0g recorded in NHANES dietary data for Hypertension and Prediabetes patients.
Prediabetes,Cream,dangerous,Cream is high in fat/sugar and may worsen prediabetes.
neurodegenerative diseases,coffee,safe,"Our findings strongly suggest that some foods, especially coffee, can act as a rich source of ÃÂÃÂ²-carbolines, which may possibly be associated with a reduced risk for serious neurodegenerative diseases, such as Parkinson's and Alzheimer's."
cardiovascular and neurodegenerative diseases,extra-virgin olive oil,safe,"The phenolic compounds of extra-virgin olive oil can act at various levels to protect individuals against cardiovascular and neurodegenerative diseases, cancer, and osteoporosis, among others."
asthma,cigarette smoke,dangerous,Cigarette smoke and secondhand (passive) smoke have been causally related to asthma and lung cancer.
Hypertension,Seeds,safe,Seeds may support balanced diet for hypertension.
chronic diseases,coffee consumption,safe,"Coffee consumption has been associated with a significant decrease in the risk of developing chronic diseases such as Parkinson disease, diabetes type-2 and several types of cancers (e.g. colon, liver)."
hypersensitivity,cereals,dangerous,Hypersensitivity to cereals may occur via inhalation or ingestion.
carcinogenic,ginger root,safe,"Zingerone, a major component found in ginger root, has been known as anti-mutagenic and anti-carcinogenic activities that are often associated with its anti-oxidative and anti-inflammatory activities."
cognitive decline,red wine,safe,These effects have been related to the protection against cognitive decline associated with aging and disease by a number of polyphenols found in red wine and extra virgin olive oil.
asthma,high fructose corn syrup sweetened soft drink,dangerous,High fructose corn syrup (HFCS) sweetened soft drink intake has been linked with asthma in US high-schoolers.
Prediabetes,coffee/soda drink/iced tea,can worsen,coffee/soda drink/iced tea with serving size 240.0g recorded in NHANES dietary data for Hypertension and Prediabetes patients.
urolithiasis,fruit,safe,"Regarding food, intake of fruit correlated negatively with the incidence of urolithiasis (r = -0.721, p = 0.008), while intake of eggs (r = 0.537, p = 0.072) and sugar (r = 0.475, p = 0.119) tended to positively correlate with incidence."
rhinitis,wheat flour,dangerous,Sensitization to inhaled wheat flour may lead to occupational rhinitis and/or asthma.
infections,breast milk,safe,Breast milk is not only a completely adapted nutrition source for the newborn but also an impressive array of immune-active molecules that afford protection against infections and shape mucosal immune responses.
cancer,oolong tea,safe,"Evidence regarding the health benefits of oolong tea consumption is accumulating, and tea polyphenols have various pharmacological properties such as anti-cancer and anti-diabetes effects."
Prediabetes,Cheese,safe,Cheese may support balanced diet for prediabetes.
pathogenic viral infections,functional foods,safe,"Functional foods optimize the immune system capacity to prevent and control pathogenic viral infections, while physical activity augments such protective benefits."
Hypertension,Chicken/Turkey,safe,Chicken/Turkey may support balanced diet for hypertension.
osteoarthritis,symptomatic slow-acting drugs,safe,Evidence supports the use of glucosamine and chondroitin as symptomatic slow-acting drugs for osteoarthritis (SYSADOAs) with impact on OA symptoms and disease-modifying effects in the long term.
bone loss,regular-fish oil,safe,"The preventive effect of high-dose (9%) regular-fish oil (FO) against bone loss during aging has been demonstrated, but the effects of a low-dose (1%-4%) of a highly purified concentrated FO (CFO) has not been elucidated."
Prediabetes,fruit and vegetable smoothie,safe,fruit and vegetable smoothie is nutritious and may help manage prediabetes.
Hypertension,egg omelet substitute,can worsen,egg omelet substitute with serving size 61.0g recorded in NHANES dietary data for Hypertension and Prediabetes patients.
cardiovascular disease,ultra-processed foods,dangerous,A high percentage of total calories from ultra-processed foods has been associated with several cardiovascular disease risk factors.
cutis laxa,drugs,dangerous,"In most cases, acquired cutis laxa is associated with neoplasms, drugs, and autoimmune diseases."
Hypertension,beet greens/collards/cress/romaine/greens/spinach,safe,beet greens/collards/cress/romaine/greens/spinach may support balanced diet for hypertension.
cardiovascular and cerebrovascular diseases,fruit,safe,Fruit and vegetable consumption was considered a protective effect against cardiovascular and cerebrovascular diseases (CVDs).
colon cancer,crushed garlic,safe,"Here, we identified Z-ajoene, a sulfur containing compound isolated from crushed garlic, as an inhibitor of colon cancer cell growth."
Prediabetes,butter,can worsen,butter with serving size 14.2g recorded in NHANES dietary data for Hypertension and Prediabetes patients.
ailments,ginger,safe,Ginger (from the rizhome of Zingiber officinale Roscoe) has been widely used in ethnomedicine for the cure of several ailments.
allergy,almond,dangerous,Oral food challenges have demonstrated that diagnosis of almond allergy based on extract-sIgE tests display low specificity.
dementia,nobiletin from citrus peels,safe,"Previously, we identified nobiletin from citrus peels as a natural compound possessing anti-dementia activity."
hypoxia,brassica rapa,safe,"The Tibetan turnip (Brassica rapa L.) has a wide array of medicine properties including heat-clearing, detoxifying and anti-hypoxia as listed in the famous centuries-old Tibetan medicine classic ""The Four Medical Tantras""."
cardiovascular diseases,fruit,safe,Fruit and vegetable intake has been reported as one of the significant protective factors against the development of cardiovascular diseases (CVD).
colon cancer,garlic,safe,"The results indicate that grape, soybean, green tea, garlic, olive, and pomegranate are the most effective plants against colon cancer."
osteoporosis,salt,dangerous,"Salt has notoriously been blamed for causing an increase in the urinary excretion of calcium, and thus is a considered a risk factor for osteoporosis."
Prediabetes,Cheese,can worsen,Cheese with serving size 32.0g recorded in NHANES dietary data for Hypertension and Prediabetes patients.
Prediabetes,Bread,safe,Bread may support balanced diet for prediabetes.
ad,sugar,dangerous,"The origin of AD is multifactorial, and many metabolic disorders originating from overconsumption of fat, cholesterol, and sugar are associated with higher risk of AD later in life."
Prediabetes,raw vegetables,safe,raw vegetables is nutritious and may help manage prediabetes.
allergy,wheat flour,dangerous,Occupational allergy to components of wheat flour is the main cause of rhinitis and asthma of workers in bakeries and similar activities.
Hypertension,milk,can worsen,milk with serving size 244.0g recorded in NHANES dietary data for Hypertension and Prediabetes patients.
Hypertension,Cheese,safe,Cheese may support balanced diet for hypertension.
asthma,less healthy diet,dangerous,"We observed a significant positive association between less healthy diet, as expressed by higher FSAm-NPS DI, and the asthma symptom score."
chronic diseases,beer,safe,"In beer, the variety and concentration of bioactive compounds in the non-alcoholic fraction suggests that its consumption at moderate levels may not only be harmless but could also positively contribute to an improvement of certain physiological states and be also useful in the prevention of different chronic diseases."
Hypertension,Fish,can worsen,Fish with serving size 85.0g recorded in NHANES dietary data for Hypertension and Prediabetes patients.
g6pd) deficiency,blueberries,dangerous,"However, there is evidence in the literature stating that blueberries should be avoided in individuals with glucose-6-phosphate dehydrogenase (G6PD) deficiency."
cancer,oolong tea,safe,"Evidence regarding the health benefits of oolong tea consumption is accumulating, and tea polyphenols have various pharmacological properties such as anti-cancer and anti-diabetes effects."
Prediabetes,egg omelet substitute,safe,egg omelet substitute may support balanced diet for prediabetes.
respiratory symptoms,ammonia,dangerous,"High endotoxin, ammonia, and dust levels contribute to acute and chronic respiratory symptoms in people who work in these settings."
ad,olive oil (,safe,A growing body of evidence including our studies supports a protective effect of oleocanthal (OC) and extra-virgin olive oil (EVOO) at early AD stages before the onset of pathology.
Hypertension,egg omelet,safe,egg omelet may support balanced diet for hypertension.
dementia,tofu,dangerous,"In older people in Indonesia, Hawai'i and China, tofu, which can contain high levels of phytoestrogens, was found to increase dementia risk."
osteoporotic fractures,virgin olive oil,safe,"Virgin olive oil, a key component of the Mediterranean Diet (MDiet), with recognised beneficial effects on metabolism and cardiovascular health, may decrease the risk of osteoporotic fractures."
"stomach, colorectal, breast cancer",garlic,safe,"Evidence supports the protective effects of garlic in stomach, colorectal, breast cancer in humans."
asthma,certain foods,safe,Consumption of certain foods during pregnancy has been shown to have beneficial effects on childhood asthma and allergic disease development and aggravation.
obesity,ginger,safe,Ginger exerts protective effects on obesity and its complications.
cardiometabolic disease,soy foods,safe,"Consumption of soy foods has been associated with protection against cardiometabolic disease, but the mechanisms are incompletely understood."
Prediabetes,Sussages,can worsen,Sussages with serving size 100.0g recorded in NHANES dietary data for Hypertension and Prediabetes patients.
cancer,oolong tea,safe,"Evidence regarding the health benefits of oolong tea consumption is accumulating, and tea polyphenols have various pharmacological properties such as anti-cancer and anti-diabetes effects."
cancers,olive oil,safe,"Traditional Mediterranean Diet (MD) is associated by the low-prevalence of certain types of cancers and CVDs, where olive oil plays an important role."
Hypertension,salad dressing,safe,salad dressing is nutritious and may help manage hypertension.
toxicity,ascorbic acids,dangerous,"Antioxidants such as phlorotannins, ascorbic acids, tocopherols, carotenoids from red algae showed toxicity on some cancer cells without side effects."
cardiovascular diseases,black mulberry fruits,safe,Black mulberry fruits are traditionally used in Uyghur folk medicine for the prevention and treatment of cardiovascular diseases in southern Xinjiang region of China.
obesity,ginger,safe,Ginger exerts protective effects on obesity and its complications.
inflammation,mediterranean diet,safe,A Mediterranean diet (MeDi) style has been reported as associated with a lower degree of inflammation biomarkers and with a protective role on cardiovascular and cerebrovascular events.
neural tube defects,fb1-contaminated corn,dangerous,A relationship between maternal ingestion of FB1-contaminated corn during early pregnancy and increased risk for neural tube defects (NTDs) has recently been proposed in human populations around the world where corn is a dietary staple.
human diseases,extra-virgin olive oil,safe,"Oleocanthal (OLC) is a phenolic component of extra-virgin olive oil, recently supposed to be involved in the modulation of some human diseases, such as inflammation and Alzheimer."
fatigue,citrus unshiu,safe,"Citrus unshiu (Rutaceae) is an easy-peeling citrus fruit, which has been used as a traditional Korean medicine for improving skin elasticity, relieving fatigue and cough, and preventing bronchitis, flu, and various cancers."
